Elle passe plus de temps à penser au travail qu'à le faire.,She spends more time thinking about work than doing it.
Ne prête pas à un autre le livre que tu as emprunté.,Don't lend a borrowed book to another.
Il ne sait pas parler anglais et encore moins français.,"He can't speak English, much less French."
Je ne peux pas répondre à cette question.,I can't answer that question.
Il ne leur a pas écrit depuis longtemps.,He has not written to them for a long time.
Vous n'avez pas idée de combien je veux partir.,You don't know how bad I want to leave.
Tu n'as pas idée de combien je veux partir.,You don't know how bad I want to leave.
"Quand bien même Tom était mon meilleur ami, je commence à le haïr.","Even though Tom used to be my best friend, I'm beginning to hate him."
Demain je suis occupé et je ne peux pas venir chez toi.,"Tomorrow I'm busy, and I can't come to your place."
Je ne sais laquelle de vous deux est venue en premier.,I don't know which of you came first.
Je n'avais jamais pensé que ce serait si facile.,I never thought it would be so easy.
Je suis désolé au sujet de la nuit dernière.,I'm sorry about last night.
"Non, je ne peux pas vous laisser entrer, il y a une personne de trop.","No, I cannot let you in, there's one person too many."
Je veux votre nom et votre numéro de passe.,I want your name and badge number.
Je pense que ça vaut le coup de demander.,I think it's worth asking.
Cela fait cinq ans que mon père est mort.,It is five years since my father died.
Vous devez prendre les choses comme elles sont.,You must take things as they are.
Je pense que vous vous en êtes très bien sorti.,I think you did very well.
Ça ne sert à rien d'aller à l'école si tu ne vas pas étudier.,It is no use going to school if you are not going to study.
"Ne le dites simplement à personne, d'accord ?","Just don't tell anyone, OK?"
Tu ne m'as pas encore dit pourquoi tu es ici.,You still haven't told me why you're here.
Je ne peux pas te garder ici plus longtemps.,I can't keep you here any longer.
Vous avez fait la même erreur que la dernière fois.,You made the same mistake as last time.
On dirait que personne ne se trouve à la maison.,It looks like no one's home.
Il ne sait pas ce que c'est que d'être pauvre.,He does not know what it is to be poor.
"Quand il s'agit de mon enfant, je ne suis jamais à court de soucis.","When it comes to my child, the trouble never ends."
Il y a des gens qui pensent que c'est une mauvaise idée.,There are some people who think it's a bad idea.
Si seulement j'étais aussi beau que lui.,If only I were as handsome as he is.
C'est bien tout elle de penser aux autres avant de penser à elle-même.,It is just like her to think of others before thinking of herself.
C'est un homme sur qui vous pouvez compter.,He is the man you can rely on.
Je crains que ce ne soit pas une bonne idée.,I'm afraid it's not a good idea.
La robe de Marie ne lui va pas très bien.,Mary's dress doesn't fit her very well.
Quand était la dernière fois que nous nous sommes rencontrés ?,When was the last time we met?
Tom ne pense pas qu'il sera capable de finir le travail tout seul.,Tom doesn't think he'll be able to finish the job by himself.
Il me donna le peu d'argent qu'il avait.,He gave me what little money he had.
Je veux que nous soyons tous à nouveau sous le même toit.,I want us all under one roof again.
Je ne suis pas allé à l'école le mois dernier.,I didn't go to school last month.
Il est en fait le président de la société.,He is the president of the company in fact.
"Quoi qu'il en soit, j'ai fait mon devoir.","At any rate, I did my duty."
"Je ne suis pas médecin, mais professeur.","I am not a doctor, but a teacher."
J'ai travaillé aussi dur que j'ai pu de manière à ne pas échouer.,I worked as hard as I could so I didn't fail.
J'étais tout juste à l'heure pour le dernier train.,I was just in time for the last train.
Tu ne sais ce que c'est que d'être pauvre.,You don't know what it is to be poor.
"De tous mes amis, il est le plus proche.","Of all my friends, he is the closest."
Tom est trop jeune pour conduire une voiture.,Tom is too young to drive a car.
"Je pense qu'il viendra, mais je n'en suis pas tout à fait sûr.","I think he's coming, but I'm not quite sure."
Cette histoire pour enfants est assez facile pour un enfant de 7 ans.,This children's story is easy enough for a seven-year-old child to read.
"Vu que j'ai été très occupé hier, je me sens très fatigué ce matin.","Having been busy all day yesterday, I feel very tired this morning."
Je veux juste regarder un peu la télévision.,I just want to watch a little television.
Cet enfant parle comme s'il était un homme.,The child talks as if he were a man.
Je ne me le rappelle pas mais j'aimerais le faire.,"I don't remember, but I wish I did."
Tu ne devrais pas avoir confiance en Tom.,You shouldn't trust Tom.
Ce livre est assez facile pour être lu par des enfants.,This book is easy enough for children to read.
Elle a laissé beaucoup d'argent à son fils.,She left her son a lot of money.
Nous avons appris la nouvelle de sa mort.,We received word of her death.
Tu as fait la même erreur que la dernière fois.,You made the same mistake as last time.
Le jeune homme sait peu de choses de son propre pays.,The young man knows little of his own country.
Je ne veux pas du tout être ici en particulier.,I don't particularly want to be here at all.
Je n'ai trouvé mon père ni dans sa chambre ni dans le jardin.,I found my father neither in his room nor in the garden.
Je ne fais pas attention à ce que disent les gens.,I do not mind what people say.
J'ai besoin de votre réponse avant la fin de la journée.,I need your answer by the end of the day.
Je suis toujours à la maison le dimanche.,I am always at home on Sundays.
"Ce n'est pas seulement Tom qui doit étudier, je dois étudier aussi.",Not only Tom but I have to study.
Je pris conscience de ce qui avait lieu.,I realized what was happening.
Je n'ai pas eu de ses nouvelles depuis cinq ans.,I have heard nothing from him for five years.
"Vous n'en avez pas besoin d'une, maintenant.",You don't need one now.
Il n'y a rien de nouveau sous le soleil.,There is no new thing under the sun.
"J'ai oublié mon parapluie ici, mais je n'arrive plus à le trouver.","I left my umbrella here, but now I can't find it."
"Il n'est pas médecin, il est professeur.",He is not a doctor but a teacher.
Je veux que tu ailles dans ta chambre et que tu verrouilles la porte.,I want you to go to your room and lock the door.
Il n'y a jamais eu de bonne guerre ni de mauvaise paix.,There never was a good war nor a bad peace.
C'est exactement le livre que tu voulais.,This is the very book you wanted.
Mon oncle vient me voir de temps en temps.,My uncle comes to see me from time to time.
Il a un grand bureau dans sa petite pièce.,He has a large desk in his small room.
Je me demande comment le temps sera demain.,I wonder what the weather will be like tomorrow.
Je veux en entendre davantage à ce sujet.,I want to hear more about this.
"Quelques minutes après avoir fini son travail, il est allé se coucher.","A few minutes after he finished his work, he went to bed."
Je ne peux pas sortir parce que j'ai des devoirs.,I can't go out because I have a lot of homework.
Je pense que ça a dû arriver comme Tom l'a dit.,I think it must've happened just the way Tom said it did.
"D'une part je suis occupé, d'autre part, je ne suis pas intéressé.","For one thing, I'm busy; for another, I'm not interested."
Au Japon il n'y a pas de lac plus grand que le lac Biwa.,"In Japan, there isn't any lake greater than Lake Biwa."
Je veux présenter mes excuses à vous tous pour ce qui vient d'arriver.,I want to apologize to all of you for what just happened.
Il y a un bus qui part toutes les dix minutes.,The bus leaves every ten minutes.
Tom avait des problèmes avec sa voiture.,Tom was having car trouble.
Je l'ai vue il y a aujourd'hui une semaine.,I saw her a week ago today.
"Elle n'a que deux ans, mais elle peut déjà compter jusqu'à 100.","She's only two years old, but she can already count to 100."
J'ai fait bien attention de ne pas tomber.,I took good care that I did not fall.
Nous avons vu les enfants rentrer dans la pièce.,We saw the children enter the room.
Tu n'aurais pas dû lui dire une telle chose.,You ought not to have said a thing like that to him.
Elle m'a regardé de travers parce que je n'ai pas le sens de l'humour.,She looks down on me for not having a sense of humor.
Tu ne devrais pas boire autant de café tard dans la nuit.,You shouldn't drink so much coffee late at night.
Tous les hommes ne peuvent pas être heureux.,Every man cannot be happy.
J'étais sûr que c'était ce que je voulais.,I was so sure this was what I wanted.
"Il a dit qu'il ne connaissait pas cet homme, ce qui était un mensonge.","He said he did not know the man, which was a lie."
Elle passe trop de temps à regarder la télévision.,She's spending too much time watching TV.
"Un pauvre n'est pas celui qui a trop peu, mais celui qui veut trop.","Poor is not the one who has too little, but the one who wants too much."
Le docteur a dit à Tom qu'il avait besoin de perdre du poids.,The doctor told Tom that he needed to lose some weight.
Je n'arrive à faire confiance à personne.,I can't trust anybody.
"Tu n'en as pas besoin d'une, maintenant.",You don't need one now.
"Elle lui demanda de rester, mais il devait se rendre au travail.","She asked him to stay, but he had to go to work."
Vous ne pouvez pas retirer ce que vous avez dit.,You cannot take back what you have said.
On ne peut pas avoir à la fois le beurre et l'argent du beurre.,You can't have your cake and eat it.
Bon était sur le point de partir quand je l'ai appelé.,Bob was on the point of leaving when I called him.
Il n'y a point de réponse à votre question.,There is not an answer for your question.
Je n'ai que moitié moins de livres que lui.,I have only half as many books as he does.
Je me réjouis que vous soyez ici avec moi.,I'm glad you're here with me.
"Tu peux dormir ici, un moment, si tu veux.",You can sleep here for a while if you want to.
Tu devrais passer un peu de temps chaque jour à revoir du vocabulaire,You should spend a little time each day reviewing vocabulary.
"S'il vous plaît, faites comme chez vous.",Please make yourself at home.
"Je suis désolé, c'est plus fort que moi.","I'm sorry, but I can't resist."
Elle n'a vraiment rien à voir avec cette affaire.,She has nothing to do with that affair.
Il parle très bien et l'anglais et le français.,He can speak both English and French very well.
Tu vois la couleur ? Ça veut dire que tu es enceinte !,Do you see the color? It means you're pregnant!
Quel est le numéro du bus que je dois prendre ?,What number bus do I take?
Je suppose que tu n'as jamais appris à faire ça.,I guess you never learned how to do this.
Le bureau de mon père est près de la gare.,The office where my father works is near the station.
"À dire vrai, cette idée ne me plaît pas.","Frankly speaking, I don't like the idea."
La police m'a dit de ne pas quitter la ville.,The police told me not to leave town.
Un homme est plus ou moins ce à quoi il ressemble.,A man is more or less what he looks like.
Vous ne seriez pas en mesure de le dire.,You wouldn't be able to tell.
Je crois que je devrais partir car il se fait tard.,I think I must be leaving since it is getting late.
Je ne pense que John soit fait pour ce travail.,I don't think John is suited for the job.
Il est toujours à la recherche du succès et de la richesse.,He is always seeking for fame and wealth.
"En fait, je n'ai rien mangé depuis ce matin.","As a matter of fact, I have had nothing since this morning."
Ça fait dix ans qu'il est venu au Japon.,It is ten years since he came to Japan.
"Je suis désolé de le dire, mais le service n'est pas très bon.","I'm sorry to say, but the service isn't very good."
Il était tellement en colère qu'il ne pouvait plus parler.,He was so angry as to be unable to speak.
"Après des jours de temps chaud, il se mit à faire froid.","After days of warm weather, it became cold."
"Si tu le fais un peu plus lentement, ça va plus vite.","If you do it a bit slower, it goes quicker."
Ils nous ont fait travailler toute la journée.,They made us work all day.
La vérité est que je suis un homme dans un corps d'homme.,The truth is I'm a man in a man's body.
Ce travail est simple au point que même un enfant peut l'accomplir.,This work is simple enough that even a child can do it.
Je veux vous montrer quelque chose dans le bureau.,I want to show you something in the office.
J'ai appris un peu de français ici et là.,I picked up some French here and there.
C'est la chose la plus importante de toutes.,This is the most important matter of all.
Cette robe est bien trop grande pour moi.,This dress is much too large for me.
Il écrit souvent à ses parents au Japon.,He often writes to his parents in Japan.
On ne sait jamais sur qui on pourrait tomber.,One never knows whom one might run into.
Le chat n'a pas l'air heureux de nous voir.,The cat doesn't look happy to see us.
Je vois que vous vous êtes fait une amie.,I see you've made a friend.
Faire de l'argent n'est pas le seul but de la vie.,Making money is not the only goal in life.
Je le vois de temps en temps à la bibliothèque.,I see him in the library now and then.
Je veux ta réponse pour la fin de la journée.,I want your answer by the end of the day.
Le moment est venu pour moi de te dire la vérité.,The time has come when I must tell you the truth.
"Il n'avait rien à dire, alors il est parti.","He had nothing to say, so he went away."
Je n'ai pas essayé de me rendre plus loin.,I didn't try to go any further.
Elle était souvent en retard pour l'école.,She was often late for school.
Ce pays est environ deux fois plus grand que le Japon.,That country is about twice as large as Japan.
Il est facile pour toi de résoudre ce problème.,It is easy for you to solve this problem.
La prochaine fois ce sera à moi de conduire.,Next time it will be my turn to drive.
Il y avait un accident de la route sur le chemin du retour.,I met with a traffic accident on my way back.
Alors tu ne comprends donc pas cette peine ?,So you don't understand this sentence?
Marie et moi sommes dans la même classe.,Mary and I are in the same class.
"Ce livre, que j'ai lu deux fois, a été un cadeau de Peter.","This book, which I've read twice, was a gift from Peter."
Tout le monde est arrivé à l'heure en classe.,Everybody came to the class on time.
Je ne vois jamais cette photo sans penser à mon père.,I never see this picture without thinking of my father.
Les gens qui ne veulent pas y aller n'ont pas besoin de le faire.,"People who don't want to go, don't have to."
"Bien que vieux, il est en très bonne santé.","Though he is old, he is very healthy."
On est jamais trop vieux pour apprendre.,It is never too late to learn.
Tu n'avais pas besoin de prendre un parapluie avec toi.,You needn't have taken an umbrella with you.
Je me demande si le professeur travaille ici.,I wonder if the teacher works here.
La cuisine de cette maison est très grande.,The kitchen of this house is very large.
Je suis désolée mais je ne comprends pas.,"I'm sorry, but I don't understand."
Je t'ai dit de ne pas parler de l'affaire en sa présence.,I told you not to talk about the matter in her presence.
Elle sera en train de dîner avec lui demain à cette heure-ci.,She'll be having dinner with him at this time tomorrow.
Je ne sais pas comment répondre à cette question.,I don't know how to reply to that question.
Nous devons trouver un moyen de faire un peu d'argent.,We have to figure out a way to make some money.
Il n'y a que trois filles dans la classe.,There are only three girls in the class.
Je suis à la gare de Tokyo en ce moment.,I'm at Tokyo Station now.
Tu crains mon vieux ! Je dois tout te dire !,You suck dude! I have to tell you everything!
Je suis tellement fatigué que je ne peux pas étudier.,I am so tired that I can't study.
Il a probablement pris un mauvais train.,He may have taken the wrong train.
Je porte toujours une montre donc je sais l'heure qu'il est.,I always wear a watch so I know what time it is.
Il était en train de déjeuner quand je suis entré dans la pièce.,He was having lunch when I entered the room.
J'aimerais avoir une raison de ne pas y aller.,I wish I had a reason not to go.
"Parce qu'il est malade, il ne peut pas venir.","Because he's sick, he can't come."
Il est arrivé à temps pour le dernier bus.,He was in time for the last bus.
Je ne peux pas me permettre de manger dans un restaurant aussi cher.,I can't afford to eat in such an expensive restaurant.
Je dois aller à cette réunion maintenant.,I need to get to this meeting now.
"S'il te plaît, ne cours pas dans la pièce.",Please don't run about the room.
Tom veut en savoir davantage sur le passé de Marie.,Tom wants to know more about Mary's past.
Je vais être aussi rapide que je le peux.,I'll be as quick as I can.
Je viens de prendre conscience de quelque chose.,I just realized something.
Les gens disent qu'il est encore en vie.,People say that he's still alive.
"Si jamais tu as besoin d'un boulot, viens me voir !","If you ever need a job, come see me."
"Il ne parle pas seulement le français, mais aussi l'anglais.","He can speak French, not to mention English."
"Je ne suis pas un vrai poisson, je ne suis qu'une simple peluche.","I'm not a real fish, I'm just a mere plushy."
Je n'ai pas pu me résoudre à prendre le poste.,I couldn't bring myself to take the job.
J'étais vraiment jeune lorsque je vous ai rencontré.,I was really young when I met you.
Je pense que Tom croit tout ce que Marie lui dit.,I think Tom believes everything Mary says.
On dirait qu'il y a moins de monde en semaine.,It seems less crowded during the week.
"Reste avec moi quand j'ai besoin de toi, s'il te plait.",Please stand by me when I need you.
Le train était en retard à cause de la neige.,The train was delayed on account of snow.
"Il ne dit rien, ce qui la mit en colère.","He said nothing, which made her angry."
C'est la maison dans laquelle je suis né et j'ai été élevé.,This is the house in which I was born and brought up.
Je ferai tout ce qui est en mon pouvoir pour aider.,I will do everything in my power to help.
Je veux vous parler à propos de ce rapport.,I want to talk to you about this report.
Il ne manque jamais d'écrire à la maison une fois par mois.,He never fails to write home once a month.
J'ai besoin de ta réponse avant la fin de la journée.,I need your answer by the end of the day.
Cela prend deux heures pour aller à l'école en bus et en train.,It takes two hours to go to school by bus and train.
Elle est venue près de moi et a demandé mon nom.,She came up to me and asked my name.
On dirait que vous avez pris du bon temps.,It sounds like you had a great time.
Mon père n'a jamais été malade de sa vie.,My father has never gotten sick in his life.
Tom ne croit pas un mot de ce que vient de dire Mary.,Tom doesn't believe a word of what Mary just said.
Je veux te montrer quelque chose dans le bureau.,I want to show you something in the office.
C'est à la maison qu'elle est la plus heureuse.,She is happiest when she is at home.
Je vais vous faire chercher à la gare par ma sœur.,I will have my sister pick you up at the station.
Tom a moins d'argent que n'en a son frère.,Tom has less money than his brother does.
J'ai pris conscience de ce qui avait lieu.,I realized what was happening.
Maintenant c'est l'heure de dire bonne nuit.,Now it's time to say good night.
Que vous et votre famille soyez heureux.,May you and your family be happy.
C'est avec beaucoup de difficultés que je lui ai donné une réponse.,I gave an answer to him with great difficulty.
"À vous entendre, vous n'êtes pas très sûr.",You don't sound too sure.
"Il faut manger pour vivre, et non vivre pour manger.","One must eat to live, and not live to eat."
Le bâtiment que j'ai vu était très grand.,The building that I saw was very large.
Je ne l'ai pas vu du tout ces derniers temps.,I haven't seen anything of him lately.
Aucun autre homme ne pourrait faire mon travail.,No other man could do my work.
Quelque chose doit être fait à ce propos rapidement.,Something must be done about it in no time.
Je ne suis pas la seule à être arrivée ici tôt.,I'm not the only one who got here early.
"À première vue, ce n'est pas une mauvaise idée.",At first glance this is not a bad idea.
Vous avez le temps de dîner avec moi ce soir ?,Do you have time to have dinner with me tonight?
Ce chapeau est un peu trop petit pour moi.,This hat is a little too small for me.
"J'ai essayé de résoudre ce problème, mais je n'ai pas pu.","I tried to solve the problem, but I couldn't."
J'aimerais beaucoup venir avec vous mais je n'ai pas d'argent.,"I would love to come with you all, but I don't have any money."
"Nous devrions vraiment acheter une nouvelle voiture, non ?","We really ought to buy a new car, oughtn't we?"
"Je l'ai attendu pendant une heure, mais il ne s'est pas montré.","I waited for him at the station for an hour, but he didn't show up."
Vous êtes le seul en qui j'ai confiance.,You're the only one I trust.
Je préfère encore rester à la maison plutôt que de sortir.,I would rather stay at home than go out.
Il m'a demandé plus d'argent que nécessaire.,He asked me for more money than was necessary.
Je n'ai jamais vu ni entendu parler d'une telle chose.,I have neither seen nor heard of such a thing.
Elle a perdu son fils dans un accident de voiture.,She lost her son in a car accident.
Cette fille avait l'air de ne pas se sentir bien.,The girl appeared sick.
C'est difficile pour un vieil homme de changer sa manière de vivre.,It's hard for an old man to change his way of living.
Rien n'est aussi simple que ça en a l'air.,Nothing is as simple as it seems.
Il n'est pas nécessaire de parler si fort.,There's no need to speak so loud.
Je suis désolé de vous avoir fait attendre.,I'm sorry to having kept you waiting.
Je pense qu'on va passer une bonne journée.,I think it's going to be a nice day.
"J'aimerais y aller avec toi, mais je n'ai pas d'argent.","I'd like to go with you, but I'm broke."
"Elles ne peuvent te faire de mal, maintenant.",They can't hurt you now.
La voiture qu'il conduit n'est pas à lui.,The car he's driving is not his.
J'ai vu la montagne pour la première fois.,I saw the mountain for the first time.
Il est facile pour lui de répondre à cette question.,It is easy for him to answer this question.
C'est passé comme une lettre à la Poste.,It went without a hitch.
Je pense que nous savons tous les deux pourquoi je suis ici.,I think we both know why I'm here.
Il fait si jeune pour son âge qu'il passe pour un lycéen.,He looks so young for his age that he passes for a college student.
Je serais heureux si tu pouvais venir avec nous.,I'd be happy if you could come with us.
Elle est très en colère contre ses enfants.,She is very angry with her children.
Personne ne le connaît très bien à part ses parents.,"Apart from his parents, no one knows him very well."
Je vous promets de rester avec vous jusqu'à ce que votre père arrive.,I promise you I'll stay with you until your father arrives.
"Ne sois pas en colère contre moi, car je l'ai fait pour toi.","Don't be angry with me, for I did it for your sake."
Je veux que tu me dises tout ce que tu en sais.,I want you to tell me everything you know about that.
Nous sommes tous les deux étudiants à cette école.,You and I are both students at this school.
J'ai pensé que ce cadeau pouvait être de vous.,I thought this present might be from you.
Ça ne prendra pas beaucoup plus de temps.,It won't take much longer.
Je n'ai fait que changer mon mot de passe.,I just changed my password.
Je me suis senti mal au sujet de ce que j'avais fait.,I felt bad about what I did.
Attention ! Il y a une voiture qui arrive !,Beware! There's a car coming!
Son père mange là deux fois par semaine.,His father eats there twice a week.
J'ai fait tout mon possible pour aider Tom à trouver un emploi.,I did everything I could to help Tom find a job.
Je l'ai fait dormir chez moi pour la nuit.,I let him sleep at my house for the night.
"Mon chat est parti, ça fait déjà trois jours qu'il a disparu.","My cat is gone, it's already missing for three days."
Rendre visite à Tom était une bonne idée.,Visiting Tom was a good idea.
Vous êtes la seule en qui j'ai confiance.,You're the only one I trust.
Je pense que ce manteau doit vous aller.,I think this coat should fit you.
Il avait l'air jeune à côté de son frère.,He looked young beside his brother.
C'est seulement à ce moment que j'ai compris ce qu'il voulait dire.,Only then did I realize what he meant.
"En un mot, je ne lui fais pas confiance.","In a word, I don't trust him."
Le train dans lequel il est parti va à la gare de Tokyo.,The train on which he left goes to Tokyo Station.
J'ai regardé Tom dans les yeux et lui ai dit la vérité.,I looked Tom in the eyes and told him the truth.
"Nous devons nous rencontrer pour prendre un verre, un de ces jours.",We must get together for a drink some time.
On dit qu'il a été très pauvre quand il était jeune.,He is said to have been very poor when he was young.
Il me dit de le rencontrer au restaurant.,He told me to meet him at the restaurant.
Je la connais depuis qu'elle est enfant.,I have known her since she was a little girl.
C'est le même dictionnaire que celui que j'ai perdu.,This is the same dictionary as I lost.
Il avait à peine fini son petit déjeuner quand le téléphone sonna.,Hardly had he finished breakfast when the telephone rang.
"Je suis désolé de dire ça, mais le service n'est pas très bon.","I'm sorry to say, but the service isn't very good."
