Je n'ai pas d'argent pour acheter ce livre.,I have no money to buy the book with.
Je sais que quelque chose va de travers.,I know something's wrong.
Tu ne dois pas être en retard à l'école.,You must not be late for school.
Il est venu en voiture à la place de venir en train.,He came by car instead of by train.
Je ne peux les laisser partir avant que la montre ne soit réparée.,I can't let them leave before the watch is fixed.
Je n'ai rien mangé de toute la journée mais je n'ai pas faim.,"I haven't eaten anything all day, but I don't feel hungry."
J'ai pris un bus pour ne pas être en retard au rendez-vous.,I took a bus so I wouldn't be late for my appointment.
J'ai eu du mal à me faire entendre à cause du bruit.,I found it difficult to make myself heard due to the noise.
Il n'y a pas assez de lumière dans cette pièce pour coudre.,There's not enough light in this room for sewing.
Chaque jour je me sens de mieux en mieux.,Every day I feel better and better.
Je sais qu'il n'a pas dit de bonnes choses à mon sujet.,I know that he didn't say good things about me.
Je me demande combien de temps ça va prendre.,I wonder how long it's going to take.
Tu dis que c'est toi qui à écrit ce livre ?,You're saying you wrote this book?
Je veux faire comme si ça n'était jamais arrivé.,I want to pretend it never happened.
Il pense qu'il sait tout mieux que les autres.,He thinks he knows best.
Je n'ai pas dit que c'était mal de manger.,I didn't say it wasn't OK to eat.
Il semble que quelque chose soit arrivé.,It seems that something has happened.
Je n'ai pas encore pris de petit déjeuner.,I have not eaten breakfast yet.
"Ce n'est pas une lumière, mais il est vraiment notre ami.","He's not a scientist, but he IS our friend."
Ne me dis pas que tu ne sais pas nager !,Don't tell me you can't swim.
Cette maison est petite mais elle est suffisamment grande pour nous.,"That house is small, but it's big enough for us."
Il parle comme s'il était un professeur.,He talks as if he were a teacher.
C'est parce qu'on m'a demandé de venir que je suis là.,It's because I was asked to come that I'm here.
Tout le monde sait qu'elle a fait tout son possible pour ses enfants.,Everyone knows that she has done everything she could for her children.
"Celui qui sait est celui qui, la plupart du temps, en dit le moins.",He who knows the most often says the least.
J'ai beaucoup de travail à faire aujourd'hui.,I have a lot of work to get through today.
Je me demande s'il est arrivé quelque chose.,I wonder if something has happened.
Tu devrais vraiment manger avant de partir.,You really should eat before you leave.
Elle a l'air de comprendre ce que je dis.,She seems to understand what I say.
C'est moi qui suppose que vous avez raison.,I suppose you are right.
Je crois que nous avons perdu assez de notre temps.,I think we've wasted enough of our time.
Mon père est deux ans plus jeune que ma mère.,My father is two years younger than my mother.
Je me demande quoi faire pour le déjeuner.,I wonder what to make for dinner.
J'ai pris cette photo il y a une semaine.,I took this picture a week ago.
Je pense qu'il vous faut maintenant partir.,I think you need to leave now.
Quelqu'un doit être là pour les enfants.,Somebody needs to be here for the children.
Il y a de nombreux mots que je ne comprends pas.,There are many words that I don't understand.
Il m'a donné le peu d'argent qu'il avait.,He gave me what little money he had about him.
C'est arrivé il y a plus de trois jours.,This happened more than three days ago.
Ne te laisse pas aller à manger de trop.,Don't get carried away and overeat.
Ne vous faites pas de souci ! Il n'y a rien qui cloche avec vous.,Don't worry. There's nothing wrong with you.
Il y a plus de filles que de garçons dans cette école.,There are more girls than boys in this school.
Je veux voir ce qu'il y a à la télé en ce moment.,I want to watch what's on TV right now.
Je me souviens encore de la première fois.,I still remember the first time.
Tom ne pourrait pas faire une telle chose.,Tom couldn't do something like that.
Je doute que ce soit quoi que ce soit qui vous intéresserait.,I doubt this is anything you'd be interested in.
Nous étions tout le temps en train de parler entre nous.,We were talking to each other all the time.
J'étais alors juste en train de partir de chez moi.,I was just leaving home then.
Ce n'est que depuis hier que je suis au courant de l'événement.,Not until yesterday did I know of the event.
Il ne faut pas avoir les yeux plus gros que le ventre.,You shouldn't have your eyes bigger than your belly.
Tout le monde se mit à parler en même temps.,Everyone started talking at once.
"Ne le dis pas à ma femme, s'il te plaît !",Please don't tell my wife.
Le nouveau professeur est plutôt comme un ami que comme un professeur.,The new teacher is more like a friend than a teacher.
C'est à vous de décider de ce que vous voulez faire.,It is up to you to decide what to do.
Il passe de nombreuses heures à ne rien faire.,He often spends his time idly.
Tom nous a dit qu'il avait un mal de tête.,Tom told us that he had a headache.
J'ai peur de ne pas avoir le temps de les finir.,I'm afraid I can't finish them in time.
Ce sont de jeunes hommes comme vous qu'il nous faut pour ce travail.,Young men such as you are needed for this work.
"Un bon livre est le meilleur des amis, maintenant et pour toujours.","A good book is the best of friends, the same today and forever."
Plus grand ne veut pas toujours dire meilleur.,Bigger doesn't always mean better.
J'ai dû sortir quelque chose de la voiture.,I had to get something out of the car.
Elle ne voulait pas en parler davantage.,She didn’t want to talk about it further.
Il te faut sortir davantage de la maison.,You need to get out of the house more.
Il a ce qu'il faut pour réussir dans le monde des affaires.,He's got what it takes to make it in the business world.
C'est à toi de décider de ce que tu veux faire.,It is up to you to decide what to do.
Tom m'a dit beaucoup de choses à ton sujet.,Tom told me a lot about you.
Vous êtes libre de faire ce que bon vous semble avec votre argent.,You are free to do as you please with your money.
Tu peux rester aussi longtemps que tu veux.,You can stay as long as you like.
Je veux savoir exactement ce que vous avez fait.,I want to know exactly what you did.
Je n'y suis pas allé en raison du mauvais temps.,"Owing to bad weather, I didn't go."
Je ne sais pas s'il sera d'accord ou non avec notre projet.,I don't know whether he will agree to our plan or not.
Je pensais que ça pouvait être une bonne idée.,I thought that would be a great idea.
Je pense que je suis vraiment amoureux pour la première fois.,I think I'm really in love for the first time.
Je pense que mon japonais est vraiment mauvais.,I think my Japanese is really bad.
"Alors, c'est quoi que tu veux que je fasse ?",So what is it you want me to do?
Tom est en train de jouer avec son fils.,Tom is playing with his son.
"Je ne veux plus rien entendre de cette histoire, je vous prie.",Please don't let me hear any more of that story.
La femme qui parle avec ce garçon est son professeur.,The lady that is speaking to that boy is his teacher.
Il était en colère à cause de ce qu'elle avait dit.,He was angry because of what she said.
"Ne dis rien, à moins que ce ne soit important !",Don't say anything unless it's important.
"La voiture est vieille, mais elle est bonne.","The car is old, but it is good."
Je sais que vous voulez me rendre heureux.,I know you want to make me happy.
Je sais que la dernière chose que vous vouliez faire est de m'aider.,I know that the last thing you want to do is help me.
Je vais vous faire une proposition que vous ne pouvez pas refuser.,I'm going to make you an offer that you can't refuse.
Tom ne sait pas encore s'il peut y aller ou non.,Tom doesn't yet know whether he can go or not.
Je pense que j'ai des problèmes avec ma femme.,I think I'm in trouble with my wife.
J'ai eu du mal à trouver sa maison hier.,I had some trouble finding her house yesterday.
Je n'ai pas l'argent pour acheter une voiture.,I don't have the money to buy a car.
"Demain est un autre jour, mais il ne sera pas ici avant demain !","Tomorrow is another day, but it won't be here until tomorrow!"
On dirait bien que je ne suis pas le seul à être seul.,Seems I'm not alone in being alone.
C'est très facile pour moi de lire ce livre.,This book is easy for me to read.
Il est encore en colère contre vous à cause de votre conduite.,He is still angry with you for your conduct.
Je ne me suis jamais rendu dans cette ville.,I have never been to that town.
"Il était très fatigué, c'est pour cela qu'il est allé au lit tôt.","He was very tired, so he went to bed early."
Il est arrivé juste à temps pour le dernier train.,He was just in time for the last train.
J'étais juste dans les temps pour le dernier train.,I was just in time for the last train.
Rien n'est impossible pour celui qui n'a pas à le faire lui-même.,Nothing is impossible for the man who doesn't have to do it himself.
Elle donne à manger à son chien la même chose qu'elle mange.,She feeds her dog the same thing that she eats.
"Je peux conduire une voiture, mais pas Tom.","I can drive a car, but Tom can't."
Je n'arrive pas vraiment à me le rappeler.,I can't really remember.
Il faut que vous soyez là pour votre famille.,You need to be here for your family.
"Il y a longtemps, il y avait un jeune homme.","A long time ago, there was a young man."
Je suis désolé que mon ami ne soit pas là.,I am sorry that my friend is not here.
Il était trop jeune pour aller à l'école.,He was too young to go to school.
Je suis en plein en train de faire quelque chose.,I'm right in the middle of doing something.
Il a eu beaucoup de chance de trouver un bon travail.,He was so fortunate as it find a good job.
Je n'ai pas pu aller à l'école pendant une semaine.,I have not been able to go to school for a week.
"Peu importe qui dit ça, je ne peux pas y croire.","No matter who says so, I can't believe that."
Je veux faire mon boulot du mieux que je peux.,I want to do my job the best I can.
Il a décidé de ne pas se rendre à la réunion.,He has decided not to go to the meeting.
Elle a perdu le peu d'argent qu'elle avait.,She lost what little money she had.
Nous avons à peine le temps de prendre notre petit déjeuner.,We hardly have time to eat breakfast.
"Chaque fois que je suis venu le voir, je l'ai trouvé au travail.","Each time I went to see him, I found him at work."
Il m'a demandé s'il y avait quelqu'un ici.,He asked me whether anybody was there.
Jamais je n'ai vu quoi que ce soit de tel.,I've never seen anything like this.
Je ne comprends vraiment pas ce problème.,I really don't understand this problem.
On peut dire la même chose de beaucoup d'autres gens.,The same can be said of many other persons.
"J'ai besoin de me trouver seul, un moment.",I need to be alone for a while.
Tu pourrais tout aussi bien rester où tu es.,You may as well stay where you are.
Je dois à mes parents d'être qui je suis aujourd'hui.,I owe what I am to my parents.
C'est la plus belle chose que j'ai jamais vue.,It's the most beautiful thing I've ever seen.
Je n'ai pas beaucoup d'argent maintenant.,I don't have much money now.
Elle est trop jeune pour aller à l'école.,She is too young to go to school.
Elle lui a conseillé de ne pas y aller seul.,She warned him not to go alone.
Ce que vous savez ne peut vous faire de mal.,What you know cannot hurt you.
Il est maintenant presque aussi grand que son père.,He is now almost as tall as his father is.
Tu devrais faire attention à ce que tu dis.,You should be careful what you say.
"Vous devriez aller à la maison, maintenant.",You should go home now.
Je suppose que j'ai eu envie de manger quelque chose de différent.,I guess I felt like eating something different.
Je te ferai savoir si je trouve quoi que ce soit d'intéressant.,I'll let you know if I find anything interesting.
Ce que je vais dire doit seulement rester entre nous.,What I'm about to say is strictly between you and me.
Il ne vous est pas nécessaire de venir si tôt.,You don't need to come so early.
Nous sommes sur le point de nous mettre à table pour dîner.,We are about to sit down to dinner.
Elle dit qu'elle y a pris beaucoup de plaisir.,She says that she enjoyed it very much.
Vous ne pouvez pas nous faire nous arrêter.,You can't make us stop.
Je n'ai pas voulu quoi que ce soit de tout ça.,I didn't want any of that.
Je pense qu'il te faut maintenant partir.,I think you need to leave now.
"Si tu as besoin de te faire conduire, je pourrais venir te chercher.","If you need a ride, I could come and get you."
Il ne savait pas ce qu'il ne pouvait pas faire.,He didn't know what he couldn't do.
J'ai vraiment plaisir à passer du temps avec vous.,I really enjoy spending time with you.
Il vient voir mon fils de temps en temps.,He comes to see my son now and then.
Je ne l'ai pas rencontré de nouveau après cela.,I didn't meet him again after that.
Il est arrivé le jour où elle est partie.,He arrived the day she left.
Nager est une chose que je sais assez bien faire.,Swimming is one thing I can do fairly well.
Je suis désolé que vous ne soyez pas venu avec nous.,I'm sorry for your not having come with us.
Je suppose que nous devrions aller prendre quelque chose à manger.,I guess we should go get something to eat.
Je ne peux pas te raconter ce que nous avons fait hier soir.,I can't tell you what we did last night.
"Si tu ne veux pas rester seul, je peux te tenir compagnie.","If you don't want to stay alone, I can keep you company."
Elle parle comme si elle était professeur.,She speaks as if she were a teacher.
Le garçon était si fatigué qu'il ne pouvait pas faire un pas de plus.,The boy was so tired that he could walk no longer.
Je n'ai pas pu me faire comprendre en anglais.,I could not make myself understood in English.
Je pensais à lui demander de sortir avec moi.,I was thinking about asking her out.
J'ai passé beaucoup trop de temps à penser à ce problème.,I've spent way too much time thinking about this problem.
Je vois pourquoi vous ne voulez pas y aller.,I see why you don't want to go there.
"Le plus souvent, il est en retard pour l'école.","More often than not, he is late for school."
Il a eu la chance de trouver un travail.,He had the fortune to find a job.
Tu peux rester ici aussi longtemps que tu veux.,You may stay here as long as you like.
Vraiment ? Je ne savais pas qu'elle était ta sœur.,Really? I didn't know she was your sister.
Elle n'est pas le genre de fille que tu crois.,She's not the kind of girl you think she is.
Fais attention à ne pas te mettre dans un mauvais pas.,Beware that you don't get into trouble.
Cela lui a pris trois mois pour apprendre à faire du vélo.,It took him three months to learn to ride a bicycle.
Je voudrais aller à la maison maintenant.,I would like to go home now.
Je suis presque aussi grand que mon père maintenant.,I am about as big as my father now.
"Je dois me rendre au travail, maintenant.",I have to go to work now.
Je lui ai seulement donné ce dont elle avait besoin.,I gave her just what she needed.
C'est pourquoi je vous dis de ne pas partir seul.,That's why I'm telling you not to go alone.
Mon père est fier du fait que je sois grand et beau.,My father is proud of me being tall and handsome.
Il semble qu'il ait quelque chose à voir avec le sujet.,It seems that he has something to do with the matter.
"Si tu veux que je le fasse, je le ferai pour toi.","If you want me to, I'll do that for you."
Je veux lui laisser ce travail difficile.,I want to leave this difficult job to her.
Je vous demande de le faire parce que j'ai confiance en vous.,I'm asking you to do this because I trust you.
Une personne sur trois dans cette ville a sa propre voiture.,One out of three persons in this city has his own car.
Je voulais discuter avec vous de quelque chose.,I wanted to talk to you about something.
"Mon père devrait se trouver à la maison, maintenant.",My father may be at home now.
Le travail était fini avant que je n'arrive.,The work was finished before I arrived.
Tu n'es simplement pas la personne que je pensais.,You’re just not the person I thought you were.
Vous pouvez parler tant que vous voulez.,You may talk as much as you like.
"Vous êtes une très bonne équipe, mais la leur est la meilleure.","Your team is very good, but theirs is the best."
Je me sens comme si j'étais une autre personne.,I feel like another person.
Je ne suis pas sûr que je puisse me fier à toi.,I'm not sure I can trust you.
J'ai beaucoup appris de ce que j'ai entendu.,I learned a lot from what I heard.
Je ne pense pas arriver à faire encore ça.,I don't think I can do this anymore.
J'ai vraiment passé du bon temps avec votre famille.,I had a really great time with your family.
J'ai trouvé qu'il était difficile de lire ce livre.,I found it difficult to read the book.
Ce que tu es importe davantage que ce que tu as.,What you are is more important than what you have.
C'est la toute meilleure manière de le faire.,This is the very best way to do it.
Il n'a pas eu de chance pour trouver du travail.,He had no luck in finding work.
Je pense que c'est exactement ce que je ferais.,I think that's exactly what I'd do.
C'est parce que sa mère est malade qu'il ne peut pas venir à l'école.,It is because his mother is ill that he cannot come to school.
"Il n'est que cinq heures du matin, mais le jour est déjà levé.","It's just five in the morning, but nevertheless it is light out."
Je me demande si vous êtes vraiment heureux.,I wonder if you are truly happy.
C'est le plus grand de tous les garçons.,He is the tallest of all boys.
Tom peut parler aussi un peu de français.,Tom can also speak some French.
J'avais mal à la tête et j'ai pris un jour de congé aujourd'hui.,"I had a headache, and I took the day off today."
"Je n'ai pas envie de faire quoi que ce soit, aujourd'hui.",I don't feel like doing anything today.
Aujourd'hui je n'ai pas envie de faire quoi que ce soit.,Today I don't feel like doing anything.
"Je vous en prie, faites comme chez vous.",Make yourself comfortable.
Vous ne pouvez parler de ça à quiconque.,You can't tell anyone about this.
"Il me donne du mal, comme il fait toujours.","He gives me a bad time, as he always does."
"Tu as beaucoup d'argent, et je n'en ai pas.","You have a lot of money, and I have none."
C'est un grand plaisir pour moi de me trouver ici.,It is a great pleasure to be here.
Ce qui m'a le plus surpris c'est que j'étais le seul à me faire virer.,What really surprised me most was that I was the only one who got fired.
Que veut faire ton fils quand il sera grand ?,What does your son want to be when he grows up?
Ce livre anglais est trop difficile à lire pour moi.,This English book is too difficult for me to read.
Je ne comprends rien à ce que vous dites.,I don't understand a thing you're saying.
Ne faites pas attention à ce qu'elle dit.,Never mind what she says.
Je suis venu au Japon pour la première fois.,I came to Japan for the first time.
Vous n'êtes pas obligé de le faire si vous ne le voulez vraiment pas.,You don't have to do that if you don't really want to.
Je ne vois vraiment pas de raison de rester.,I really see no reason to stay.
Il avait dit qu'il avait vu le film avant.,He said that he had seen the picture before.
"En fait, on ne peut pas compter sur elle.","In fact, she's quite unreliable."
J'ai fait comme si ça n'était pas arrivé.,I pretended it didn't happen.
Elle veut passer du temps avec sa fille.,She wants to spend time with her daughter.
Je n'ai pas tout à fait compris le nom de ce créateur.,I didn't quite catch the name of that designer.
"Tant que tu ne fais pas de bruit, tu peux rester ici.",You can stay here as long as you don't make any noise.
Il ne parle jamais de son propre travail.,He never speaks of his own job.
J'ai trouvé quelque chose que je pensais avoir perdu.,I found something I thought I'd lost.
Elle pense qu'elle sait tout mieux que les autres.,She thinks she knows best.
Je suis resté plus longtemps que je ne pensais le faire.,I stayed longer than I thought I would.
"Si tu veux, je peux venir te chercher au travail.",I can pick you up from work if you want me to.
J'ai tellement de travail que je reste une heure de plus.,I have so much work that I will stay for one more hour.
Il est plus grand que n'importe quel autre chien de cette ville.,It's bigger than any other dog in this town.
On n'a pas pu y aller parce qu'on n'avait pas de voiture.,We couldn't go there because we didn't have a car.
Je suis plutôt sûre que je n'ai pas dit ça.,I'm pretty sure I didn't say that.
Vous avez l'air très bien sur cette photo.,You look very good in that photo.
Nous avons fait un tour de la ville en voiture.,We took a turn around the city in our car.
"Comme je suis occupé, je ne peux pas y aller.","As I am busy, I cannot go."
"Parler est une chose, et écrire en est une autre.",To speak is one thing and to write is another.
Il y a une part de vérité dans ce qu'il dit.,There is a certain amount of truth in what he's saying.
"Jour après jour, il fait de plus en plus chaud.",It becomes warmer day after day.
Ce n'est pas un homme sur qui on peut compter.,He is not a man to rely on.
Il fait de plus en plus chaud jour après jour.,It is becoming warmer day by day.
Je te demande de le faire parce que j'ai confiance en toi.,I'm asking you to do this because I trust you.
Je ne connais pas la femme qui parle à notre professeur.,I do not know the woman talking to our teacher.
Je suis heureux de vous avoir rencontré.,I'm very happy to make your acquaintance.
Je ne voulais pas attendre après quoi que ce soit.,I didn't want to wait for anything.
Elle a appris à son enfant à ne jamais jouer avec des allumettes.,She taught the child never to play with matches.
Je n'ai jamais eu à m'en faire pour l'argent.,I never had to worry about money.
Je pense que Tom ne serait pas d'accord.,I think Tom would disagree.
Mon oncle a fait de moi ce que je suis aujourd'hui.,My uncle has made me what I am today.
"Je ne voulais vraiment pas aller au travail, aujourd'hui.",I really didn't want to go to work today.
"Tu as une très bonne équipe, mais la leur est la meilleure.","Your team is very good, but theirs is the best."
"La nuit, c'est là que la plupart des gens vont au lit.",Night is when most people go to bed.
J'ai écrit à la maison une lettre à mes parents.,I wrote a letter to my parents at home.
J'ai écrit une lettre à mes parents à la maison.,I wrote a letter to my parents at home.
Et je sais que tu ne l'as pas fait pour moi.,And I know you didn't do it for me.
Tom est l'homme qu'il faut pour ce travail.,Tom is the right man for the job.
Rien de tout ça n'a aucun sens pour moi.,None of this makes any sense to me.
Quelle voiture est celle de votre père ?,Which car is your father's?
"Je sais que j'ai donné la bonne réponse, cette fois.",I know I got it right this time.
De nos jours il est difficile de trouver du travail.,Nowadays jobs are hard to come by.
"Ils étaient dans cette pièce, avec moi, toute la nuit.",They were in that room with me all night.
J'ai bien peur qu'il ne nous reste plus rien à manger.,I truly fear that nothing is left for us to eat.
Elle est assez jeune pour être ta fille.,She's young enough to be your daughter.
Elle est occupée à l'heure qu'il est et ne peut pas te parler.,She's busy now and can't speak to you.
J'ai eu besoin de votre aide mais je n'ai pas pu vous trouver.,"I needed your help on something, but I couldn't find you."
Je me sens heureux lorsque je suis avec toi.,I feel happy when I'm with you.
Mère est en train de lui faire un gâteau.,Mother is making him a cake.
Ça m'a pris beaucoup de temps de me remettre de ma dernière relation.,It took me a long time to get over my last relationship.
Mon fils est maintenant aussi grand que moi.,My son is now as tall as I am.
Elle nous a demandé de la laisser seule.,She asked us to leave her alone.
Le médecin a dit à Tom qu'il ne lui reste plus que six mois à vivre.,The doctor told Tom that he only had six months to live.
"Si j'étais toi, je ne ferais pas une telle chose.","Were I you, I wouldn't do such a thing."
Je ne le ferais pas si j'étais à ta place.,I wouldn't do it if I were you.
"Il m'a dit que, quoi qu'il puisse arriver, il y était préparé.","He told me that whatever might happen, he was prepared for it."
Je savais que tu ferais quelque chose de grand.,I knew you would do something great.
Elle m'a dit de la rencontrer chez elle.,She told me to meet her at her house.
La liberté est ce que vous faites avec ce qui a été fait pour vous.,Freedom is what you do with what's been done to you.
Elle est deux ans plus vieille que vous.,She is two years older than you.
"J'ai du boulot à faire, alors va te faire voir et fous-moi la paix.","I've got work to do, so piss off and leave me alone."
"Tu voulais que je trouve un boulot, c'est ce que j'ai fait.","You wanted me to get a job, so I did."
Je pensais que ça avait l'air d'une bonne idée.,I thought it sounded like a good idea.
"Je ne peux quitter la maison, même pour un moment.",I cannot leave home even for a moment.
Il dit qu'il y a trouvé beaucoup de plaisir.,He says that he enjoyed it very much.
Je suis désolée de ne pas vous avoir écrit pendant aussi longtemps.,I am sorry that I haven't written to you in such a long time.
Je ne peux pas manger ce genre de nourriture.,I can't eat this kind of food.
Je veux savoir ce qui se trouve à bord de ce train.,I want to know what's on that train.
Je ne crois pas du tout que ce soit étrange.,I don't think it's strange at all.
Ce que l'on sait ne peut nous faire de mal.,What you know cannot hurt you.
J'ai essayé de faire tout ce que je pouvais.,I tried to do all I could.
